{
  "format": "lcir.chip",
  "formatVersion": 5,
  "id": "half-adder",
  "name": "Half adder",
  "version": 1,
  "pins": [
    {
      "id": "pin-in_a",
      "name": "A",
      "dir": "in",
      "width": 1,
      "role": "data",
      "order": 0,
      "boundComponent": "in_a"
    },
    {
      "id": "pin-in_b",
      "name": "B",
      "dir": "in",
      "width": 1,
      "role": "data",
      "order": 1,
      "boundComponent": "in_b"
    },
    {
      "id": "pin-out_s",
      "name": "S",
      "dir": "out",
      "width": 1,
      "role": "data",
      "order": 0,
      "boundComponent": "out_s"
    },
    {
      "id": "pin-out_cout",
      "name": "Cout",
      "dir": "out",
      "width": 1,
      "role": "data",
      "order": 1,
      "boundComponent": "out_cout"
    }
  ],
  "components": [
    {
      "id": "in_a",
      "kind": "inport",
      "pos": {
        "x": 48,
        "y": 48
      },
      "label": "A",
      "params": {
        "width": 1
      }
    },
    {
      "id": "in_b",
      "kind": "inport",
      "pos": {
        "x": 48,
        "y": 144
      },
      "label": "B",
      "params": {
        "width": 1
      }
    },
    {
      "id": "g_sum",
      "kind": "xor",
      "pos": {
        "x": 120,
        "y": 48
      }
    },
    {
      "id": "g_carry",
      "kind": "and",
      "pos": {
        "x": 120,
        "y": 128
      }
    },
    {
      "id": "out_s",
      "kind": "outport",
      "pos": {
        "x": 224,
        "y": 56
      },
      "label": "S",
      "params": {
        "width": 1
      }
    },
    {
      "id": "out_cout",
      "kind": "outport",
      "pos": {
        "x": 224,
        "y": 136
      },
      "label": "Cout",
      "params": {
        "width": 1
      }
    }
  ],
  "wires": [
    {
      "id": "w3",
      "a": {
        "kind": "pin",
        "component": "in_a",
        "pin": "y"
      },
      "b": {
        "kind": "junction",
        "junction": "j1"
      },
      "points": []
    },
    {
      "id": "w4",
      "a": {
        "kind": "junction",
        "junction": "j1"
      },
      "b": {
        "kind": "pin",
        "component": "g_sum",
        "pin": "a"
      },
      "points": []
    },
    {
      "id": "w5",
      "a": {
        "kind": "junction",
        "junction": "j1"
      },
      "b": {
        "kind": "pin",
        "component": "g_carry",
        "pin": "a"
      },
      "points": [
        {
          "x": 112,
          "y": 136
        }
      ]
    },
    {
      "id": "w6",
      "a": {
        "kind": "pin",
        "component": "g_sum",
        "pin": "b"
      },
      "b": {
        "kind": "junction",
        "junction": "j2"
      },
      "points": [
        {
          "x": 96,
          "y": 72
        }
      ]
    },
    {
      "id": "w7",
      "a": {
        "kind": "pin",
        "component": "in_b",
        "pin": "y"
      },
      "b": {
        "kind": "junction",
        "junction": "j2"
      },
      "points": []
    },
    {
      "id": "w8",
      "a": {
        "kind": "junction",
        "junction": "j2"
      },
      "b": {
        "kind": "pin",
        "component": "g_carry",
        "pin": "b"
      },
      "points": []
    },
    {
      "id": "w2",
      "a": {
        "kind": "pin",
        "component": "g_sum",
        "pin": "y"
      },
      "b": {
        "kind": "pin",
        "component": "out_s",
        "pin": "a"
      },
      "points": []
    },
    {
      "id": "w1",
      "a": {
        "kind": "pin",
        "component": "g_carry",
        "pin": "y"
      },
      "b": {
        "kind": "pin",
        "component": "out_cout",
        "pin": "a"
      },
      "points": []
    }
  ],
  "junctions": [
    {
      "id": "j1",
      "pos": {
        "x": 112,
        "y": 56
      }
    },
    {
      "id": "j2",
      "pos": {
        "x": 96,
        "y": 152
      }
    }
  ]
}
